热门查询,点击次数,展示,点击率,排名
flat chested sex doll,25,139,17.99%,7.58
flat chested sex dolls,8,44,18.18%,16.16
sex doll small tits,6,14,42.86%,2.57
small tit sex doll,3,18,16.67%,2.89
small tits sex doll,2,30,6.67%,8.97
flat chest sex dolls,2,21,9.52%,21.48
small breast sex torso,2,5,40%,1.2
flat chested sex doll torso,2,2,100%,1
small flat chested sex doll,1,8,12.5%,22.5
mini flat chested sex dolls,1,7,14.29%,15.71
sex dolls small tits,1,5,20%,4.6
small breast sex dolls,1,4,25%,13.25
sex dolls flat chested,1,4,25%,18.75
small boob sex doll,1,4,25%,24.75
sex doll with small tits,1,3,33.33%,7
flat chest sex torso,1,2,50%,1
fucking flat chested sex doll,1,2,50%,7
sex doll small breast,1,2,50%,16
small tit sex dolls,1,1,100%,1
tiny tit sex doll,1,1,100%,2
can you provide a link,1,1,100%,9
flat chest sex doll,1,1,100%,15
sex with flat chest,1,1,100%,16
small breasted sex dolls,1,1,100%,18
small breast sex doll,0,16,0%,23.75
flat chested sexdoll,0,14,0%,15.43
flat chested love doll,0,10,0%,48.6
flatchested sex dolls,0,8,0%,18
sexdoll flatchest,0,8,0%,30.5
flat chest sexdoll,0,7,0%,25.71
sex doll flat,0,6,0%,21.33
sex dolls flat chest,0,6,0%,23.5
flatchest sex doll,0,5,0%,7.6
flat chest sexdoll porn,0,5,0%,8
small tits sex dolls,0,4,0%,7.75
small chest sex doll,0,4,0%,16.25
sex doll small boobs,0,4,0%,21.25
sexdoll flat chested,0,4,0%,21.25
sex doll flat chested,0,4,0%,21.5
sexdoll flat,0,4,0%,24.5
flat chest teen sex doll,0,3,0%,4.33
flatchested sex doll,0,3,0%,7.33
small flat chested sex dolls,0,3,0%,16
sex dolls flat,0,3,0%,16.67
mini sex doll flat chest,0,3,0%,18
small breasts sex doll,0,3,0%,28.33
flat chested sex,0,3,0%,31.33
flat chested love dolls,0,3,0%,51
small flat chest sex doll,0,2,0%,9.5
flatchest sexdoll,0,2,0%,14
flat chest sexdolls,0,2,0%,15.5
flatchested sexdoll,0,2,0%,22.5
flat chested sex dolls for sale,0,2,0%,23.5
sexdoll flat chest,0,2,0%,26
flat sex dolls,0,2,0%,27
small boobs sex doll,0,2,0%,30
flat chested sexdolls,0,1,0%,2
cheap,0,1,0%,5
flat chest doll sex,0,1,0%,9
flat chest doll porn,0,1,0%,10
small chested sex doll,0,1,0%,13
sexdoll small breast,0,1,0%,15
ex dolls b cup pointy breasts chinese woman,0,1,0%,18
sexdolls flat chest,0,1,0%,19
ex dolls b cup pointy breasts,0,1,0%,20
flat chest sex,0,1,0%,21
small breasts sex dolls,0,1,0%,27
small breast love doll,0,1,0%,38
small sex doll,0,1,0%,98
little sex dolls,0,1,0%,148